NAME,CONTACT NO,RATING,RATING COUNT,ADDRESS,LOCATION,CATEGORY
Sumer Chand Tara Chand,+(91)9152303132,3.8,29,"Shop No-68/3, Sadar Bazaar, Basai Road, Gurgaon - 122001, Near Zevar Mahal",Gurgaon,Grocery Stores
Om Shivay Kirana Store,+(91)9152783343,3.5,2,"Shop.no 2, Rajiv Nagar Gurgaon, Gurgaon - 122001, Near . Siv Mandir Chowk",Gurgaon,Grocery Stores
Max Super Marche,+(91)9818950767,4.3,39,"A-7, Krishna Tower, Palam Vihar, Gurgaon - 122017, Near By Mahindra Aura Apartments",Gurgaon,Grocery Stores
Big Bazaar (Ambience Mall),18002662255,4.2,5892,"Lower Ground Floor, Ambience Mall, National Highway No 8, Nathupur, Gurgaon - 122002",Gurgaon,Grocery Stores
Le Marche,+(91)1242806019,4.2,1764,"SG 105 & 107, Dlf City Phase 4, Gurgaon - 122002, Galleria Market, Near Dlf City Club",Gurgaon,Grocery Stores
Le Marche,+(91)1244898450,4.1,1274,"23, Upper Ground Floor, South Point Mall, Golf Course Road, Dlf City Phase 5, Gurgaon - 122002, Near Genpact",Gurgaon,Grocery Stores
Easy Day Express,+(91)01244666555,3.8,1043,"SCO 69 & 70, Huda Market Road, Gurgaon Sector 10a, Gurgaon - 122001, Sector 10 A Market",Gurgaon,Grocery Stores
Variety Store,+(91)9152116551,4.2,15,"Shop No-5 & 6, D-Block Market, South City 2, Gurgaon - 122018",Gurgaon,Grocery Stores
Big Mart Retail Solutions P..,+(91)9152294401,3.8,180,"20 A 1, Old Mehraulii Road, Palam Colony, Delhi - 110045, Raj Nagar Part II",Gurgaon,Grocery Stores
The Vital Mart,+(91)1149281960,4.3,28,"G-1,2 Pankaj Arcade Plot No.5, Pocket-4, Dwarka Sector 11, Delhi - 110075",Gurgaon,Grocery Stores
Pooja Super Mart,+(91)7011548375,3.8,3,"K/577,, Ramesh Singh Complex, Mahipalpur, Delhi - 110037, Near Grls Mcd School",Gurgaon,Grocery Stores
Pallavi Foods Chain Complet..,+(91)8826292627,4.5,11,"D-64 Qutub Vihar Phase-2, Gali No-5 Taj Pur Road, Tajpur Khurd, Delhi - 110071, Hanuman Chowk",Gurgaon,Grocery Stores
Mehta Enterprises,+(91)1244037633,3.5,2,"G-103, Sapphire  83 Mall, Gurgaon Sector 83, gurgaon - 122004, Near Inox",Gurgaon,Grocery Stores
Balaji Trading Company,+(91)9210346175,4.9,12,"RZ-172, Gali No-4, Vaishali Colony, Dabri, Delhi - 110045, Backside Jindal Public School",Gurgaon,Grocery Stores
Dev Super Mart,+(91)8860693385,3.8,55,"New Town Heights, Dlf, Gurgaon Sector 86, gurgaon - 122051",Gurgaon,Grocery Stores
Aggarwal Super Mart,+(91)1141043299,4.1,1026,"A-3/86,87, Mota Singh Road, Janakpuri, Delhi - 110058, Near St Francis School",Gurgaon,Grocery Stores
Bakington The Pastry Shop,+(91)1145066550,4.2,1968,"A 3/230, Janakpuri, Delhi - 110058, Opposite St Francis School",Gurgaon,Grocery Stores
Daily Needs,+(91)1141745500,4.0,822,"45,Corner Market, Malviya Nagar, Delhi - 110017",Gurgaon,Grocery Stores
Csd Food Bazaar,+(91)9971377480,4.3,53,"336 Kakrolla Housing Complex, Dwarka More, Delhi - 110059, NEAR Metro Pillar No.789",Gurgaon,Grocery Stores
Kendra Bhandar,+(91)9999208399,4.2,13,"West Krishna Vihar, Main Khira Road, Najafgarh, Delhi - 110043, Near Vanshikha Gander",Gurgaon,Grocery Stores
Jain Confectionery & Import..,+(91)9152329222,3.8,41,"Shop Number 266, INA Market, Delhi - 110022, Opposite Delhi Hart",Gurgaon,Grocery Stores
Garg Store,+(91)9152195709,4.3,429,"SHOP NO 19/2 Yusuf, Aurobindo Marg, Yusuf Sarai-Green Park, Delhi - 110016, Near Metro Station Gate No 4",Gurgaon,Grocery Stores
Grocery Fresh,+(91)7011848560,3.0,7,"81, Masjid Moth Village, Masjid Moth Road, South Extension 2, Delhi - 110049, Near Masjid",Gurgaon,Grocery Stores
Jangid Patanjali Store,+(91)9999205908,4.3,11,"Shop No - 362 , D Block, Gali N - 4, Sangam Vihar, Delhi - 110080, Near Batra Hospital",Gurgaon,Grocery Stores
Sethi Atta Chaki Laxmi Gene..,+(91)7982622759,4.1,14,"Shop No. 41, Old Market, Tilak Nagar, Delhi - 110018, Near Geeta Bhawan Mandir",Gurgaon,Grocery Stores
Modern Bazaar,+(91)9152478089,4.0,842,"47, North Avenue, Club Road, Punjabi Bagh, delhi - 110026",Gurgaon,Grocery Stores
Daily Delite,+(91)9152428108,4.0,225,"Building No. 98, F Block,Central Market, Kirti Nagar, Delhi - 110015",Gurgaon,Grocery Stores
New Amit Bakers,+(91)01125157622,4.1,114,"3/14 A, Main Market, Moti Nagar, Delhi - 110015, Near Fun Cinema",Gurgaon,Grocery Stores
Apna Store,+(91)1125280050,4.1,316,"Shop Number-21/23/2, Ground Floor, Paschim Vihar, Delhi - 110063, Behind IFCI Flats, Jwala Heri Market",Gurgaon,Grocery Stores
Bhagat Ram Om Prakash Depar..,+(91)1129815943,4.2,268,"32 & 33, Lajpat Nagar 1, Delhi - 110024, Krishna Market",Gurgaon,Grocery Stores
S M City Bazar,+(91)9152273712,5.0,4,"174, Avtar Enclave , Opposite Dominoz, Paschim Vihar, Delhi - 110063, Near Bikaner Corner",Gurgaon,Grocery Stores
Jaideep Mega Store,+(91)9152316777,4.4,703,"Shop-154, Mangolpur Kalan, Rohini Sector 2, Delhi - 110085, Opp. - Pocket 4, Near Jain Sweet Wali Gali and Maruti Service Station",Gurgaon,Grocery Stores
Modern Bazaar,+(91)9152410724,4.2,1111,"15, Community Center, New Friends Colony, Delhi - 110025, Behind Surya Sofitel Hotel",Gurgaon,Grocery Stores
Anand Bhandar,+(91)9810010525,5.0,1015,"Dry Fruits and Spices - ANAND BHANDAR (BELLA NUTS), 7727 New Market, Karol Bagh, Delhi - 110005, Near Liberty Cinema",Gurgaon,Grocery Stores
Guruji Grocery & Vegetables,+(91)9152820166,3.5,2,"A-13/5, Rana Pratap Bagh, delhi - 110007, Near Community Centre",Gurgaon,Grocery Stores
Ram Narain Suresh Kumar,+(91)9152158196,4.5,3,"Shop No 403, Main Road Near Katra Paidan, Khari Baoli, Delhi - 110006, Opposite Gadodia Market",Gurgaon,Grocery Stores
Bachat Bazaar,+(91)9152385010,4.8,61,"G-27/206-207, Rohini Sector 3, Rohini, Delhi - 110085, Near St Giri Senior Secondary School",Gurgaon,Grocery Stores
A D Overseas,+(91)9152882841,3.6,14,"Shop No-14/36, Qutab Road Sadar Bazar, Sadar Bazar, Delhi - 110006",Gurgaon,Grocery Stores
Food Centre,+(91)9152516375,4.4,39,"3965/A Naya Bazar, Opp., Syndicate Bank, Naya Bazar, Delhi - 110006, Near Khari Baoli Whole Sale Market",Gurgaon,Grocery Stores
Sardaran Di Hatti,+(91)9152423287,4.2,701,"FD 8, Pitampura, Delhi - 110034, Near Metro Station Pitampura & Opposite Metro Pillar Number 368",Gurgaon,Grocery Stores
(baba Dal) Gupta Trading Co..,+(91)9810100751,4.1,60,"1j/22, Arya Samaj Road, Faridabad NIT, Faridabad - 121001, Near Dayanand School",Gurgaon,Grocery Stores
Green Pure Agri Services,+(91)9152481877,5.0,1,"J-73, Dda Market, Jahangir Puri, Delhi - 110033, Near Jahangir Puri Metro Station",Gurgaon,Grocery Stores
Rameswar Dayal & Sons,+(91)9152131828,5.0,1,"B-69/2, Gali Number-7, Shastri Park, Delhi - 110053, Near Jain Mandir",Gurgaon,Grocery Stores
Debon,+(91)9152915517,4.1,503,"D 1, Alaknanda Shopping Complex, Noida Sector 28, Noida - 201303",Gurgaon,Grocery Stores
Kolo,+(91)9958381009,4.0,31,"D-80, Noida Sector 5, Noida Sector 2, noida - 201301",Gurgaon,Grocery Stores
Shardha Traders,+(91)9152840028,4.7,9,"Shop No-B-102, Gali No-1, Barwala, Delhi - 110039, Near Gate No-1, Jain Colony",Gurgaon,Grocery Stores
Jigyasa Store,+(91)7011973896,2.4,5,"Shop No-1, Shri Radhe Lal Market, Sector 135, Noida - 201304, Near Shivalik Bank",Gurgaon,Grocery Stores
Top 10 Bazar,+(91)8745074652,3.5,2,"A 96 / 2, Jagatpur Road, Wazirabad, Delhi - 110084, Near Sachdeva Convnent School / Baba Dairy",Gurgaon,Grocery Stores
M R Traders,+(91)9210480628,4.0,10,"D-1/188. Ground Floor, Main Market, New Kondli, Delhi - 110096, Opposite Hero Showroom",Gurgaon,Grocery Stores
Indian Fresh Vegetable And ..,+(91)9152488610,4.3,4,"LGF-6, Reliance Plaza, Sector 4b,, Vasundhara Sector 4, Ghaziabad - 201012, Near Ajnara Apartment",Gurgaon,Grocery Stores
Megrocery,+(91)9152823660,3.5,2,"Shop No. K2/6 KLJ Society, Sector -77, Faridabad Sector 77, Faridabad - 121004",Gurgaon,Grocery Stores
Street Mart   Pharmacy,+(91)114122028,2.9,8,"Shop-2, Hyde Park Crown Market, Sector 78, Noida - 201305, Hyde Park",Gurgaon,Grocery Stores
Babu Store,+(91)9152473541,3.6,6,"612 G Nyay Khand -3rd, Indirapuram, Ghaziabad - 201014, Near Vivekanand School",Gurgaon,Grocery Stores
Bhadani Nuts & Dry Fruits,+(91)9152663665,4.5,7,"Shop No. 9F,  Ground Floor, Niho Scottish Market, Ahinsa Khand 2-Indirapuram, Ghaziabad - 201014",Gurgaon,Grocery Stores
Earth Mega Mart,+(91)9355181021,3.4,7,"Shop No 1, Shivam Plaza Delta 1, Delta 1, Noida - 201310, Near Gate No 1 and Community Center Delta 1",Gurgaon,Grocery Stores
