NAME,CONTACT NO,RATING,RATING COUNT,ADDRESS,LOCATION,CATEGORY
A 1 Super Market,+(91)9152337463,4.0,14,"Surya Nagar ,, Ahilyabai Holkar Road, Vikhroli West, Mumbai - 400083, Opposite Shiv Sena Office, Sambhaji Chowk",Gujarat,Grocery Stores
A P Mani Super Market Pvt L..,+(91)9152393707,4.1,284,"Shop No 2,4 & 5, Parekh Building, N G Acharya Marg, Chembur East, Mumbai - 400071, Opposite Hotel Ornament",Gujarat,Grocery Stores
Laxmi Dry Fruits  General S..,+(91)9152271883,4.7,9,"Plot No 52, Shop No 5, Chandan Apartment, Ambernath South, Thane - 421501, Opposite Bule Dart",Gujarat,Grocery Stores
Jai Kuvarka Stores,+(91)9152878133,4.1,15,"Gala No 12, Modern Society, Tilak Nagar, 90 Feet Raod, Sakinaka, Mumbai - 400072, Opposite  Dilshad Hotel",Gujarat,Grocery Stores
Quality Center,+(91)9152410752,3.9,13,"Shop No 1, I C Residency,, IC Colony, IC Colony-Borivali West, Mumbai - 400103, Opposite to Citizen Co Op Bank",Gujarat,Grocery Stores
Sai Krupa General Store,+(91)9152207545,3.5,2,"Sadguru Sahili, Shop Number 4 ,, Sabe Road, Diva, Thane - 400612, Near Vithal Mandir,",Gujarat,Grocery Stores
Rakhangi General Stores Nx,+(91)9152381092,4.0,134,"Plot No 2, Kakad Estate, R G Thadani Marg, Worli, Mumbai - 400018",Gujarat,Grocery Stores
Chhaya Super Market,+(91)9152716719,5.0,2,"Shop No 7/8 Building Patakar Plaza, Patake Cross Road, Dombivli East, Thane - 421201, Near Chandu Palace",Gujarat,Grocery Stores
Mumbai Mart,+(91)9152332005,4.8,20,"Shop No 12 Akansha Heights Opp Sai Service Station Gandhi Nagar, D S Road, Worli, Mumbai - 400018, Wellcare Pharmacy & More",Gujarat,Grocery Stores
Eden Super Bazar,+(91)9152944699,5.0,1,"Atelier Retail Bldg Ground Floor, Saket Complex Road, Thane West, Thane - 400601, RUSTOMJEE URBANIA",Gujarat,Grocery Stores
Janata Super Market,+(91)9152917875,4.0,26,"Shop No.925, Vangani Badlapur Highway, Vangani, Thane - 421503, Near Vangani Char Rasta",Gujarat,Grocery Stores
Gala Traders,+(91)9152106918,4.1,23,"Shop No 4, Gagangiri Building,  Plot No 47, Vashi Sector 17, Navi Mumbai - 400703, Near Abhudaya Bank Marg",Gujarat,Grocery Stores
Anvayi General Stores,+(91)9152697511,4.8,10,"Plot No 9 OM Shrusti Housing Society, navi mumbai - 400706, Sector 4",Gujarat,Grocery Stores
Savla Dry Fruits,+(91)9619549631,3.6,5,"Shradha Bhavan, Station Road, Thane West, Thane - 400601, Near Vishnunagar Ghantali Chowk Naupada",Gujarat,Grocery Stores
Arihant Traders,+(91)9152187928,4.7,27,"Bungalow - 85,, S V P Nagar, Four Bunglows-Andheri West, Mumbai - 400053, Near Jankidevi Lane, Near Mhada Last Bus Stop",Gujarat,Grocery Stores
Neelkanth Mart,+(91)8454007272,4.8,2,"Jijau CHS,Shop No -1,2,Plot No -4,5,6,7, Sector-17, Kamothe, navi mumbai - 410206, Near Mansarovar  Station Road",Gujarat,Grocery Stores
Mahavir Trading,+(91)9867934759,4.0,151,"Shop No 21 and 22, Merchant Center Building, Sector 19, Vashi, Navi Mumbai - 400703, Opposite Jalaram Market",Gujarat,Grocery Stores
Kamlesh Kirana Store,+(91)9152798743,3.5,2,"Khan Prerna Appartment, Shop No-2, Shivani Nagar, Golani Naka Waliv and Rajprabha Udyog Nagar, Vasai East, Palghar - 401208, Near Nidhi Industry",Gujarat,Grocery Stores
Natures Bazzaar,+(91)9152742444,4.9,25,"Shop No 1, Khokar Compound, Borivali West, Ram Nagar-Borivali West, Mumbai - 400092, Opposite Parwana Tower",Gujarat,Grocery Stores
Genu Mahadev Jadhav,+(91)2223774136,5.0,1,"Shop No 25,  New Dongri Municipal Market,, Navroji Hill Road No 2, Dongri, Mumbai - 400009, New Dongri Municipal Market",Gujarat,Grocery Stores
Mahavir Food Mart,+(91)9152461970,4.0,80,"Shop No A1/A2 Vibhavari Housing Society, N Datta Marg, Four Bunglows-andheri West, Mumbai - 400053, Near Good Sheperd Church",Gujarat,Grocery Stores
Aksar Super Market,+(91)9152620795,3.6,64,"Shop No -1, Solitaire Prathmesh Complex, Veera Desai Road, Andheri West, Mumbai - 400053, Opp Country Club",Gujarat,Grocery Stores
Rakhangis 7 L.L.P,+(91)9152295184,4.3,8,"Alankar C.h.s.l, Dr. Annie Besant Road, Worli Naka-Worli, Mumbai - 400018, Opposite Podar Hospital",Gujarat,Grocery Stores
Apna Super Market,+(91)9152287811,3.8,13,"Shop No 1, Sai Avenue, Veera Desai Road, Andheri West, Mumbai - 400058, Opposite Mvm High School",Gujarat,Grocery Stores
Jay Momai Maa Enterprises,+(91)9152221988,3.7,13,"H-27 Masala Market,, Mudibazar, Vashi, Navi Mumbai - 400703, APMC Market",Gujarat,Grocery Stores
Rajeshwar Super Market,+(91)9152952934,5.0,2,"Shop No.8, Bldg-24,, Ekta Nagar, Kandivali West, Mumbai - 400067, Near Atharva College",Gujarat,Grocery Stores
Anvayi General Stores,+(91)9152697511,4.8,10,"Plot No 9 OM Shrusti Housing Society, navi mumbai - 400706, Sector 4",Gujarat,Grocery Stores
Chhaya Super Market,+(91)9152716719,5.0,2,"Shop No 7/8 Building Patakar Plaza, Patake Cross Road, Dombivli East, Thane - 421201, Near Chandu Palace",Gujarat,Grocery Stores
Neelkanth Mart,+(91)8454007272,4.8,2,"Jijau CHS,Shop No -1,2,Plot No -4,5,6,7, Sector-17, Kamothe, navi mumbai - 410206, Near Mansarovar  Station Road",Gujarat,Grocery Stores
Joshi Khaughar,+(91)9152356515,5.0,4,"Shop No.5, Dunhill Castel Elvid Co-Operative Housing Society, Hanuman Road, Vile Parle East, Mumbai - 400057, Opposite ICICI Bank",Gujarat,Grocery Stores
Gauri Supermarket,+(91)9152884016,2.7,3,"Shubh Arcade  Plot No.22,Shop No 3,4,5, Sector  No.21, Kamothe, Navi Mumbai - 410206, Opposite Yashoda Hospital Nearby Khandeshwar Station",Gujarat,Grocery Stores
Cheap & Best,+(91)9152899551,4.3,6,"EDEN 2, Adi Shankaracharya Road, Powai, Mumbai - 400076, NEAR NATURAL ICE CREAN",Gujarat,Grocery Stores
Mahavir Food Mart,+(91)9152461970,4.0,80,"Shop No A1/A2 Vibhavari Housing Society, N Datta Marg, Four Bunglows-andheri West, Mumbai - 400053, Near Good Sheperd Church",Gujarat,Grocery Stores
Joshi Khaughar,+(91)9152356515,5.0,4,"Shop No.5, Dunhill Castel Elvid Co-Operative Housing Society, Hanuman Road, Vile Parle East, Mumbai - 400057, Opposite ICICI Bank",Gujarat,Grocery Stores
Ashish Bharatiya Bazaar Apn..,+(91)9152769730,5.0,2,"Shop 2,Shreejidham Building, Edulji Road, Thane West, thane - 400601, Near Shimla Bar",Gujarat,Grocery Stores
Naeem Masala,+(91)9152524348,3.3,8,"Shop No 23 and 24, Mirza Ghalib Market, Matka Gali, Null Bazar, Mumbai - 400003, Near Gol Deval Temple",Gujarat,Grocery Stores
Natural Food Basket,+(91)9152340627,3.6,8,"Shop No 5, Ground Floor, 109, Himalaya CHS LTD, Dr. R G Thadani Marg, Worli, mumbai - 400018, Podar Hospital",Gujarat,Grocery Stores
Meghsons,+(91)9152198479,4.0,487,"Marve Road, Malad West, Mumbai - 400064, Near Junction Of S V Road & Marve Road",Gujarat,Grocery Stores
Kamlesh Kirana Store,+(91)9152798743,3.5,2,"Khan Prerna Appartment, Shop No-2, Shivani Nagar, Golani Naka Waliv and Rajprabha Udyog Nagar, Vasai East, Palghar - 401208, Near Nidhi Industry",Gujarat,Grocery Stores
Kuvarji Khimraj & Company,+(91)9152851773,4.2,41,"Shop No 132 134, S V P Road, Null Bazar, Mumbai - 400003, Gol Dev Mandir (Shiv Mandir)",Gujarat,Grocery Stores
Genu Mahadev Jadhav,+(91)2223774136,5.0,1,"Shop No 25,  New Dongri Municipal Market,, Navroji Hill Road No 2, Dongri, Mumbai - 400009, New Dongri Municipal Market",Gujarat,Grocery Stores
Gauri Supermarket,+(91)9152884016,2.7,3,"Shubh Arcade  Plot No.22,Shop No 3,4,5, Sector  No.21, Kamothe, Navi Mumbai - 410206, Opposite Yashoda Hospital Nearby Khandeshwar Station",Gujarat,Grocery Stores
Thane Super Market,+(91)9152226996,3.8,40,"Prayag Tirth, Veer Savarkar Marg, Naupada-thane West, Thane - 400602, Opposite Lokmanya Society",Gujarat,Grocery Stores
Janta Supreme Punjabi Atta,+(91)9152334709,4.3,15,"Shop No 36, Sanmukhanand Hall Road, Sion Koliwada, Mumbai - 400022, Behind Hazara Hotel, Near Mini Punjab Hotel",Gujarat,Grocery Stores
Sahakar Dhanya Bhandar,+(91)2221635003,4.1,217,"Shop No 3 ,, Poorva Megh Chs, Mulund East, Mumbai - 400081, Junction Of L.T Road & G V Scheme No 2",Gujarat,Grocery Stores
Shree Ganesh Stores,+(91)9769858893,4.7,16,"Shop No 5, Ismail Kureshi Compound, New Link Road, Behram Baug-Jogeshwari West, Mumbai - 400102, Opposite Three Star Bakery,Near Mahatma Gandhi School",Gujarat,Grocery Stores
Jain Traders,+(91)02228633569,4.0,136,"Shop No 10, Parshava Kunj Building, Mathurdas Road, Kandivali West, Mumbai - 400067, Next to Hari Om Hotel",Gujarat,Grocery Stores
Sky Home Super Market,+(91)2226771155,4.2,78,"Shop No 4, B Wing, Dev Prestige, Veera Desai Road, Andheri West, Mumbai - 400058, Near Corporation Bank",Gujarat,Grocery Stores
Chetna Stores,+(91)8806882220,4.7,17,"Plot No 52, Chandan Building, Kansai Road, Ambernath, Thane - 421501, Near Kansai Section",Gujarat,Grocery Stores
Laxmi Super Market,+(91)2226352792,3.9,80,"Mahada Building No 40, Shop No 3, New Link Road, Andheri West, Mumbai - 400053, Opposite Shriji Hotel",Gujarat,Grocery Stores
Laxmi Super Market,+(91)2226352792,3.9,80,"Mahada Building No 40, Shop No 3, New Link Road, Andheri West, Mumbai - 400053, Opposite Shriji Hotel",Gujarat,Grocery Stores
Anant Foodland,+(91)2226202291,4.2,286,"Shop No 1, Juhu Church Road, Juhu, Mumbai - 400049, Near Juhu Gymkhana Club and Juhu Bus Depo",Gujarat,Grocery Stores
Satyam Enterprises,+(91)2223483288,4.3,56,"110 & 111, Clive Road,, Dana Bandar, Mumbai - 400009, Opposite Patwa Chambers, Near Masjid Station East",Gujarat,Grocery Stores
Home Foods Supermarket,+(91)2266744200,3.8,205,"Kohinoor City Mall, G43,, Premier Road, Kurla West, Mumbai - 400070, Opposite Don Bosco College",Gujarat,Grocery Stores
Big Mart The Vegetable Shop..,+(91)8828723306,5.0,2,"Shop No 4, Shantaram Guruji Appartment,Plot No.A46, Sector 27, Seawoods, Navi Mumbai - 400706, Near- Presentation School",Gujarat,Grocery Stores
Arihant Super Market,+(91)9324359292,4.0,137,"Shop No.1/2,Vishwashanti Building, 7, Golibar Road, Santacruz East, Mumbai - 400055, Opposite Food King Hotel",Gujarat,Grocery Stores
Om Shri Arihant Store,+(91)8369309933,4.8,42,"Shop No 2 Suvidha Building, R R T Road, Mulund West, Mumbai - 400080, Opposite Vibhutee Saree",Gujarat,Grocery Stores
Milap Traders,+(91)2227801572,3.9,8,"C 56, APMC Market, Vashi, Navi Mumbai - 400703, Apmc Masala Market",Gujarat,Grocery Stores
Champion Foods,+(91)9833372840,4.3,424,"69 Kanchan Palace, M G Road, Vile Parle East, Mumbai - 400057, Near Pritam Hotel",Gujarat,Grocery Stores
Super Janta Store,+(91)2225703131,4.1,10,"Shop No 48 Prathmesh Galaxy, Hiranandani-Powai, Mumbai - 400076, OppositeVijay Vihar Building",Gujarat,Grocery Stores
Milap Traders,+(91)2227801572,3.9,8,"C 56, APMC Market, Vashi, Navi Mumbai - 400703, Apmc Masala Market",Gujarat,Grocery Stores
Jai Maa Jivdani Stores,+(91)8459237207,3.7,3,"Shop No 3 Ayesha Manzil, Rahamat Nagar Road, Nalasopara East, Palghar - 401209, Near Sitara Bakery",Gujarat,Grocery Stores
New Manisha Store,+(91)02226478971,5.0,1,"Building No 35, Room No 1897, MHB Colony, Ram Mandir Road, Bandra East, Mumbai - 400051",Gujarat,Grocery Stores
Kausa Food Bazar,+(91)9967410644,4.3,74,"Nausheen Plaza Shop No.6, Opp. Kausa Police Chowki, Old Mumbai Pune Road, Kausa, Thane - 400612, Opposite Kausa Jama Masjid  Near Alajwa Sweets",Gujarat,Grocery Stores
Champion Foods,+(91)9833372840,4.3,424,"69 Kanchan Palace, M G Road, Vile Parle East, Mumbai - 400057, Near Pritam Hotel",Gujarat,Grocery Stores
Chetna Stores,+(91)8806882220,4.7,17,"Plot No 52, Chandan Building, Kansai Road, Ambernath, Thane - 421501, Near Kansai Section",Gujarat,Grocery Stores
Jem Dal Mill,+(91)2228802539,4.3,124,"Shop No 3, Ajendu Building, Road No 1, Malad West, Mumbai - 400064, Near Bank Of Maharashtra, Liberty Garden",Gujarat,Grocery Stores
Om Shri Arihant Store,+(91)8369309933,4.8,42,"Shop No 2 Suvidha Building, R R T Road, Mulund West, Mumbai - 400080, Opposite Vibhutee Saree",Gujarat,Grocery Stores
Champion Stores,+(91)9833915603,4.6,26,"Shop 2 So Lucky Corner, Mongibai Road, Vile Parle East, Mumbai - 400057, Near Gawade Hospital",Gujarat,Grocery Stores
Anant Foodland,+(91)2226202291,4.2,286,"Shop No 1, Juhu Church Road, Juhu, Mumbai - 400049, Near Juhu Gymkhana Club and Juhu Bus Depo",Gujarat,Grocery Stores
Shree Swami Gajanan Super M..,+(91)8652807656,4.3,8,"Sakuaai Compound, Chinchpada D Wing, Shop No 9-14, Kalyan East, Thane - 421306, Near Saket College, Opposite Tuljabhavani Mandir",Gujarat,Grocery Stores
Hypercity Retail India Ltd,18002097172,4.2,20535,"New Link Road, Malad West, Mumbai - 400064, Next to Inorbit Mall, Mindspace",Gujarat,Grocery Stores
Manish Market,+(91)9833807112,3.9,7667,"Unit No 2, Ramabai Ambedkar Marg, Fort, Mumbai - 400001, Near Chhatrapati Shivaji Terminus Area",Gujarat,Grocery Stores
Big Bazaar (Metro Junction ..,+(91)02512350500,3.9,7304,"Metro Junction Mall, Sheel Road, Kalyan West, Kalyan - 421301, Near Shilphata, Netivali Village",Gujarat,Grocery Stores
Hypercity Retail INDIA Ltd,18002097172,4.0,7067,"Ground Floor, Big Thane Shopping Centre, Ghodbunder Road, Thane West, Thane - 400601, Behind Kasarwadawali Police Station, Kasarvadawali Gaon",Gujarat,Grocery Stores
Big Bazaar (Raghuleela Mall..,+(91)7710077229,4.0,7060,"C/O Raghuleela Mall, Ground Floor, Vashi, Navi Mumbai - 400703, Opposite Vashi Railway Station",Gujarat,Grocery Stores
Big Bazaar,+(91)02502320092,4.0,6460,"252 A, Dattani Cube, Bhabola Papdi Road, Vasai West, Palghar - 401201, Near Dattani Village, Near Telephone Exchange, Sandoor",Gujarat,Grocery Stores
Big Bazaar,+(91)9967797442,3.9,6360,"Yashwant Building, Dongri Bypass Road, Virar West, Palghar - 401302, Next to Mcdonalds Family Restaurant, Opposite Magnus Motors",Gujarat,Grocery Stores
Big Bazaar (Maxus Mall),+(91)8879273822,3.9,5666,"C/O Maxus Mall, Bhayandar West, Thane - 401101, Next to Fly Over, Near Temba Hospital Road",Gujarat,Grocery Stores
Sahakari Bhandar,+(91)02261362850,4.0,4588,"Plot No 843, Kashinath Dhuru Road, Prabhadevi, Mumbai - 400025, Near Junction Of SK Bole Road, Agar Bazaar, Chuchwadi",Gujarat,Grocery Stores
Star Bazaar,+(91)2267194500,4.0,3714,"Ground Floor, Shriji Arambh, Kanakia Road, Mira Road, Thane - 401107, Near Kashimira Road, Opposite Mcdonalds",Gujarat,Grocery Stores
Big Bazaar (R Mall),+(91)02233094733,3.9,3521,"1st Floor, R Mall, L B S Marg, Mulund West, Mumbai - 400080, Near Mulund Checknaka, Opposite Richardson Factory Cruddas",Gujarat,Grocery Stores
Godrej Natures Basket,+(91)02226421122,4.2,3403,"Plot No 29, Salsatte Catholic Co-Operative Housing Society, Hill Road No 56, Bandra West, Mumbai - 400050, Next to Bank Of India Building, Near Alco Market",Gujarat,Grocery Stores
Alfa 1,+(91)02226719696,3.9,2807,"116/A, Oskar House, Irla Society Road, Vile Parle West, Mumbai - 400056, Near Cooper Hospital",Gujarat,Grocery Stores
Reliance Smart (Phoenix Mar..,+(91)2240176400,3.9,2744,"Shop No 28 & 29, Phoenix Marketcity Mall, L B S Marg, Kamani-kurla West, Mumbai - 400070",Gujarat,Grocery Stores
Sahakari Bhandar,+(91)02226459350,4.0,2543,"Municipal Building,Ground Floor, Station Road, Bandra West, Mumbai - 400050, Near Railway Station",Gujarat,Grocery Stores
Sahakari Bhandar,+(91)2224096975,4.0,2453,"Shop No 3108, Matunga East, Mumbai - 400019, Behind Aurora Cinema, Kings Circle",Gujarat,Grocery Stores
Big Bazaar,+(91)02525267659,3.5,2434,"Ostwal Empire, Tarapur Boisar Road, Boisar, Palghar - 401501, Survey No 111/1/2, 111a/1/1 , Village Grampanchayat, Tarapur, Opposite S T Bus Depot",Gujarat,Grocery Stores
Godrej Natures Basket,+(91)8880077745,4.1,2133,"Shop No 4, Bg India House, Powai, Mumbai - 400076, Near Hiranandani Garden, Hiranandani Business Park",Gujarat,Grocery Stores
Janata Stores,+(91)2228076943,4.2,1971,"Ganesh Bhavan, S V Road, Borivali West, Mumbai - 400092, Near Indraprastha Shopping Centre",Gujarat,Grocery Stores
Godrej Natures Basket,+(91)02226300766,4.1,1942,"Shop No 1, Ground Floor, Samarth Aishwarya Co Operative Housing Society, Andheri West, Mumbai - 400053, Near Off KL Walawalkar Marg & Marks & Spencers",Gujarat,Grocery Stores
Big Bazaar (Thakur Mall),+(91)02228284707,3.9,1880,"Thakur Mall, Western Express Highway, Dahisar, Mumbai - 400068, Dahisar Check Naka, Opposite Sun Shine Inn Hotel",Gujarat,Grocery Stores
Ratna Supermarket,+(91)2225600455,4.3,1799,"Ratna Supermarket, P K Road, Mulund West, Mumbai - 400080, Near Pius Church",Gujarat,Grocery Stores
Hypercity Retail India Ltd ..,+(91)02240501305,4.1,1789,"Ground Floor, Inorbit Mall, Plot No 39/1, Vashi, Navi Mumbai - 400703, Near Centre One Shopping Mall & Railway Station, Behind Hotel Tunga, Sector No 30 A, Sector 17",Gujarat,Grocery Stores
Star Market A TATA And Tesc..,+(91)9029002233,4.2,1672,"123, Mistry Bhavan, Dinshaw Vacha Road, Churchgate, Mumbai - 400020, Near Churchgate Railway Station, Beside KC and HR",Gujarat,Grocery Stores
Society Stores,+(91)02226615637,4.2,1653,"Shop No. 97/B, Ground Floor, Juhu Garden Co-Operative  Housing Society, Juhu Road, Santacruz West, Mumbai - 400054, Near Standard Chartered Bank, Opposite State Bank Of India",Gujarat,Grocery Stores
Sahakari Bhandar,+(91)02225289777,4.0,1640,"3r Society, Research Centre, R C Marg, Chembur East, Mumbai - 400071, Opposite Jain Mandir",Gujarat,Grocery Stores
Godrej Natures Basket (Ober..,+(91)2228428801,4.2,1581,"Shop No S-23 A, Second Floor, Oberoi Mall, Goregaon East, Mumbai - 400063, Near Off Western Express Highway, Near Dindoshi Depot",Gujarat,Grocery Stores
Reliance Smart (DVictoria M..,+(91)02228988118,4.0,1580,"2nd Floor, D Victoria Mall, Shimpoli Road, Borivali West, Mumbai - 400092, Near Borivali Railway Station",Gujarat,Grocery Stores
Chheda Stores,+(91)02224144245,4.3,1431,"Building No.292, Bhanu Jyoti, L N Road, Matunga East, Mumbai - 400019, Opposite Matunga Central Station",Gujarat,Grocery Stores
Sahakari Bhandar,+(91)9967015248,3.9,1425,"Fun Fiesta, Ground Floor, Sri Prastha Complex, Sri Swastik Mega City, Nalasopara West, Palghar - 401203, Opposite Poonam Complex",Gujarat,Grocery Stores
Food Hall (Palladium Mall),+(91)2230264567,4.2,1423,"3rd Floor, Palladium Mall, High Street Phoenix Compound, Senapati Bapat Marg, Lower Parel, Mumbai - 400013, Opposite Manchester United Bar Cafe, Near Phoenix Mall",Gujarat,Grocery Stores
Godrej Natures Basket,+(91)2225307338,4.2,1296,"Shop No 1& 2, Zenia Building, Ghodbunder Road, Hiranandani Estate-thane West, Thane - 400607",Gujarat,Grocery Stores
Godrej Natures Basket,+(91)02223545151,4.1,1292,"Shop No.8, Ground Floor, Tirupati Apartment, Bhulabhai Desai Road, Warden Road, Mumbai - 400026, Opposite Mahalaxmi Temple, Near Nalli Sarees",Gujarat,Grocery Stores
Sahakari Bhandar,+(91)2222154552,3.9,1245,"Shop No 21, Colaba Chamber, Shahid Bhagat Singh Marg, Colaba, Mumbai - 400005, Opposite to GPO, Near Bus Depot, Next to Sassoon Dock",Gujarat,Grocery Stores
Apna bazar,+(91)2228686473,3.9,1216,"Dr Ambedkar Raod, Kandivali West, Mumbai - 400067, Sector No 5, Charkop Market",Gujarat,Grocery Stores
Sahakari Bhandar,+(91)02226145550,4.0,1175,"V Mehta Road, Juhu, Mumbai - 400049, Near Kala Niketan, Below Dimple Hotel, JVPD Scheme",Gujarat,Grocery Stores
Apna Bazar,+(91)02224195200,4.0,1131,"Maharashtra Seva Sang Building, Pandit Jawaharlal Nehru Road, Mulund West, Mumbai - 400080",Gujarat,Grocery Stores
Sahakari Bhandar,+(91)02240176400,4.0,1131,"Barc, Anushakti Nagar, Mumbai - 400094, Behind Dilwara Building",Gujarat,Grocery Stores
Apna Bhandar,+(91)2225856350,4.0,1111,"Laxmi Industrial, Pokharan Road No 1, Vartak Nagar-Thane West, Thane - 400606, Beside Thane Janata Bank",Gujarat,Grocery Stores
Godrej Natures Basket,+(91)02226100955,4.1,1087,"B Wing, Ground Floor, Spenta Boulevard, Juhu Tara Road, Juhu, Mumbai - 400049, Opposite J W Marriott Hotel",Gujarat,Grocery Stores
Sahakari Bhandar,+(91)02223717291,3.8,1010,"19, Chetak Apartment, Love Lane, Mazgaon, Mumbai - 400010, Near Mazgaon Post Office",Gujarat,Grocery Stores
Star Bazar,+(91)9029002233,4.1,1318,"Hubtown Solaris, Shop No 3, Teli Gali, Andheri East, Mumbai - 400069, Vijay Nagar",Gujarat,Grocery Stores
Hypercity Retail India Ltd ..,+(91)02261701121,4.0,900,"Viviana Mall, 1st Floor, Eastern Express Highway, Thane West, Thane - 400601, Next to Jupiter Hospital",Gujarat,Grocery Stores
Reliance Fresh,18001032022,3.8,898,"Central City Mall, Santoshi Mata Durga Co Operative Housing Society, Parekh Holding, Lamington Road, Mumbai Central, Mumbai - 400008, Opposite Shagun Hotel & Navjeevan Society",Gujarat,Grocery Stores
Sahakari Bhandar,+(91)02228429950,3.9,879,"Municipal Market,1st Floor, Goregaon East, Mumbai - 400063, Opposite Yashodham School & Dindoshi Bus Depot,Gokuldham",Gujarat,Grocery Stores
Reliance Fresh,+(91)02240176400,3.8,854,"Sai Palace, Plot No 35, Vashi, Navi Mumbai - 400703, Near Hotel Milan SAI Palace, Near NMMC Hospital, Sector 10 A",Gujarat,Grocery Stores
Tanvi Super Market,+(91)2229203595,4.0,848,"Shop No 4, Acropulis, Military Road, Andheri East, Mumbai - 400059",Gujarat,Grocery Stores
Sahakari Bhandar,+(91)02228931389,3.9,831,"LIC Shopping Centre, Borivali West, Mumbai - 400091, Near Post Office, Behind Karnataka Bank, Jeevan Bhima Nagar, LIC Colony",Gujarat,Grocery Stores
Sahakari Bhandar,+(91)02228304538,4.0,827,"Shyam Kunj Building, Andheri East, Mumbai - 400059, Near J B Nagar Post Office",Gujarat,Grocery Stores
Bhoomi Mart,+(91)9082354997,3.8,785,"Shop No 8 to 15, Shakti Enclave, Malad West, Mumbai - 400095, Near Shakti Complex",Gujarat,Grocery Stores
Godrej Natures Basket,+(91)02222044201,4.1,744,"Ground Floor, Apeejay House, 3, Dinshaw Vacha Road, Churchgate, Mumbai - 400020, Near Kc College",Gujarat,Grocery Stores
Ghelani Super Market,+(91)02225010491,4.2,724,"248, Shalibhadra Building, Hingwala Lane, Ghatkopar East, Mumbai - 400077, Near Popular Hotel",Gujarat,Grocery Stores
Shivraj Super Shoppy,+(91)2226339636,4.0,715,"Shop No 12, Silver Streak, Yari Road,, Andheri West, Mumbai - 400061, Near Madina Masjid, Versova",Gujarat,Grocery Stores
Godrej Natures Basket,+(91)02240024008,4.1,713,"Plot No 30 A, Ground Floor, Shopping Arcade, World Trade Center, JD Somani Road, Cuffe Parade-colaba, Mumbai - 400005, Opposite IDBI Bank",Gujarat,Grocery Stores
Godrej Natures Basket,+(91)2224339347,4.2,696,"Shop No 2, Ground Floor, Century Bhavan, Dr Annie Besant Road, Prabhadevi, Mumbai - 400025, Near Century Bazaar",Gujarat,Grocery Stores
Eden Supermarket,+(91)2225862200,4.2,668,"Shop No.12 to 19, Crown Building, Ghodbunder Road, Hiranandani Estate-thane West, Thane - 400607, Near Bhoomi Acres  Complex, Patlipada",Gujarat,Grocery Stores
Daily Needs,+(91)2227702988,4.2,666,"Shop No 6, Shreeji Heights 6, Plot No 1a,1b,1c, Nerul, Navi Mumbai - 400706, Sector 46 A, Seawoods",Gujarat,Grocery Stores
White Magic,+(91)02224167001,4.1,652,"BPT Plot No 2, Acharya Donde Marg, Sewri, Mumbai - 400015, Near Sewri Bus Depot",Gujarat,Grocery Stores
Daily Needs Enterprises,+(91)9004582252,4.1,649,"The Orien Coperative Housing Society Shop No.1 to 5, Sector 20, Roadpali, Kalamboli, Navi Mumbai - 410218, Near Police Headquarters",Gujarat,Grocery Stores
Sahakari Bhandar,+(91)02225281922,3.9,630,"Ground Floor, Diamond Hotel Building, Central Avenue Road, Chembur East, Mumbai - 400071, Near Ambedkar Garden",Gujarat,Grocery Stores
Sahakari Bhandar,+(91)02240176400,4.0,623,"Shyam Kamal C Building,Ground Floor, Vile Parle East, Mumbai - 400057, Behind Dinanath Mangeshkar Hall, Agarwal Market",Gujarat,Grocery Stores
Asmita Supermarket,+(91)02228113596,3.9,620,"Asmita Township, Naya Nagar, Shanti Park-mira Road, Thane - 401107, Near Station Road",Gujarat,Grocery Stores
M B Mart,+(91)2228401153,4.0,593,"Plot No A-1, A-2, Thavar Madan Chawl, Daftary Road, Malad East, Mumbai - 400097, Opposite Jain Mandir, Kurar Village, Near Highway",Gujarat,Grocery Stores
Shivraj Super Market,+(91)02225142828,4.0,590,"Traffic Light Building, M.G.Road, Ghatkopar West, Mumbai - 400086, Near Bank of Baroda",Gujarat,Grocery Stores
First Choice Super Market 3,+(91)02228381414,4.0,588,"Shop No 1&2, New Mahakali Development Road, Andheri East, Mumbai - 400093, Opposite Takshila Gate No 2",Gujarat,Grocery Stores
Godrej Natures Basket,+(91)02225197788,4.3,582,"Ground Floor, Godrej One, Eastern Express Highway, Vikhroli East, Mumbai - 400079, Pirojsha Nagar, Opposite Bus Stop",Gujarat,Grocery Stores
Trust Super Mart,+(91)7669797979,3.9,572,"Shop No 13, Moring Glory Tropical Lagoon 5, Ghodbunder Road, Kasarvadavali, Thane - 400615, Near Aanand Nagar Bus Stop",Gujarat,Grocery Stores
Milan Super Shoppe,+(91)02228924617,4.2,568,"Shop No 1 to 4, Ground Floor, Sagar Apartment, Devidas Lane, Borivali West, Mumbai - 400092, Near Prem Nagar, Opposite to New Flyover",Gujarat,Grocery Stores
Daily Needs,+(91)2227564756,4.0,566,"F 4, Shop No 15 & 16 F Tab Appartment & Market, Sector 4, Cbd Belapur, Navi Mumbai - 400614, Opposite Aboday Bank",Gujarat,Grocery Stores
Ratna Departmental Store,+(91)02221025422,4.1,563,"Shop No 7,8,9 Kailash Mahal, Vallabh Baug Lane,60 Feet, Ghatkopar East, Mumbai - 400077, Near Kotak Mahindra Bank",Gujarat,Grocery Stores
Sahakari Bhandar,+(91)2228114884,4.0,560,"Ground Floor, Trivedi Complex, Church Road, Mira Road, Thane - 401107, Next to Simla Complex",Gujarat,Grocery Stores
Apna Bazar,+(91)8080232861,3.9,552,"Plot 16, Franchisee Shivam Enterprises 36, Shree Tower, Kharghar, Navi Mumbai - 410210, Near Sector 20",Gujarat,Grocery Stores
Gangar Stores,+(91)02224128561,4.1,510,"D-16, Empire Mahal, Tilak Road, Dadar East, Mumbai - 400014, Near Dadar T.T Circle",Gujarat,Grocery Stores
Kalwa Super Market,+(91)02225368166,3.6,500,"Urvi Building, Old Belapur Road, Kalwa, Thane - 400605",Gujarat,Grocery Stores
My Home Super Shopee,+(91)2228612342,4.1,495,"Shop No 1-3, Grace Arcade, Jankalyan Nagar, Malad West, Mumbai - 400095, Near Radha Krishna Hotel, Off Marve Road, Jankalyan Nagar",Gujarat,Grocery Stores
Meena Bazaar,+(91)2226428391,4.1,482,"Aram Hotel. Ground Floor, Aram Shopping Centre, Govt Colony, Bandra East, Mumbai - 400051, Opposite Chetna College, Government Colony",Gujarat,Grocery Stores
